{
  "apiVersion": "safe-runtime.dev/tck-fixture/v1alpha1",
  "id": "TCK_ADAPTER_DSH_TOOL_ORDERING_PARALLEL_MODEL_ORDER_001",
  "profile": "ADAPTER_DSH",
  "description": "Preserves source observation order for parallel requests whose final results commit in model order even when live timestamps are non-monotonic.",
  "determinism": {
    "seed": 31102,
    "clock": {
      "startUnixMs": 1770002000000,
      "tickMs": 10
    }
  },
  "stimulus": {
    "operation": "tool-ordering",
    "sessionRef": "session:tck-tool-parallel",
    "sourceObservations": [
      {
        "source": "session/event",
        "type": "tool/call",
        "seq": 30,
        "time": 1770002000000,
        "data": {
          "turn": 5,
          "step": 2,
          "callId": "call-a",
          "name": "read",
          "arguments": "{\"path\":\"a.txt\"}"
        }
      },
      {
        "source": "session/event",
        "type": "tool/call",
        "seq": 31,
        "time": 1770002000010,
        "data": {
          "turn": 5,
          "step": 2,
          "callId": "call-b",
          "name": "write",
          "arguments": "{\"path\":\"b.txt\",\"content\":\"ok\"}"
        }
      },
      {
        "source": "tools/result",
        "observedAt": "2026-08-19T02:33:22.000Z",
        "execution": {
          "callId": "call-a",
          "name": "read",
          "arguments": { "path": "a.txt" }
        },
        "result": { "isError": false },
        "resultDigest": "sha256:fixture-parallel-a"
      },
      {
        "source": "tools/result",
        "observedAt": "2026-08-19T02:33:21.000Z",
        "execution": {
          "callId": "call-b",
          "name": "write",
          "arguments": { "path": "b.txt", "content": "ok" }
        },
        "result": { "isError": false },
        "resultDigest": "sha256:fixture-parallel-b"
      }
    ]
  },
  "expect": {
    "kind": "EVENTS",
    "events": [
      { "type": "tool.requested", "callRef": "call-a", "toolName": "read" },
      { "type": "tool.requested", "callRef": "call-b", "toolName": "write" },
      { "type": "tool.completed", "callRef": "call-a", "toolName": "read" },
      { "type": "tool.completed", "callRef": "call-b", "toolName": "write" }
    ]
  }
}
