{
  "apiVersion": "safe-runtime.dev/tck-fixture/v1alpha1",
  "id": "TCK_FULL_FAULT_INJECTION_EXHAUSTED_001",
  "profile": "FULL",
  "description": "Fault script exhaustion is explicit and does not fabricate a NO_FAULT directive or observation.",
  "determinism": {
    "seed": 43,
    "clock": {
      "startUnixMs": 1776502800000,
      "tickMs": 10
    }
  },
  "stimulus": {
    "operation": "fault-injection.script-exhausted",
    "config": {
      "points": ["tool.before-body"],
      "script": [
        {
          "probe": {
            "pointRef": "tool.before-body",
            "context": { "callRef": "call-1" }
          },
          "directive": { "kind": "NO_FAULT" }
        }
      ]
    },
    "probes": [
      {
        "pointRef": "tool.before-body",
        "context": { "callRef": "call-1" }
      },
      {
        "pointRef": "tool.before-body",
        "context": { "callRef": "call-2" }
      }
    ]
  },
  "expect": {
    "firstDirective": { "kind": "NO_FAULT" },
    "errorCode": "FAKE_FAULT_SCRIPT_EXHAUSTED",
    "observationCount": 1,
    "remaining": 0
  }
}
