{
  "apiVersion": "safe-runtime.dev/tck-fixture/v1alpha1",
  "id": "TCK_ADAPTER_DSH_TURN_LIFECYCLE_COMPLETED_001",
  "profile": "ADAPTER_DSH",
  "description": "Projects one completed Harness turn while keeping step/end as source-only evidence.",
  "determinism": {
    "seed": 31001,
    "clock": {
      "startUnixMs": 1770000000000,
      "tickMs": 10
    }
  },
  "stimulus": {
    "operation": "turn-lifecycle",
    "sessionRef": "session:tck-completed",
    "sourceEvents": [
      {
        "type": "turn/start",
        "seq": 10,
        "time": 1770000000000,
        "data": { "turn": 3 }
      },
      {
        "type": "step/start",
        "seq": 11,
        "time": 1770000000010,
        "data": { "turn": 3, "step": 0 }
      },
      {
        "type": "step/end",
        "seq": 12,
        "time": 1770000000020,
        "data": { "turn": 3, "step": 0 }
      },
      {
        "type": "turn/end",
        "seq": 13,
        "time": 1770000000030,
        "data": { "turn": 3, "reason": { "kind": "completed" } }
      }
    ]
  },
  "expect": {
    "kind": "EVENTS",
    "events": [
      { "type": "turn.started", "turnRef": "session:tck-completed/turn:3" },
      {
        "type": "step.started",
        "turnRef": "session:tck-completed/turn:3",
        "stepRef": "session:tck-completed/turn:3/step:0"
      },
      {
        "type": "turn.ended",
        "turnRef": "session:tck-completed/turn:3",
        "status": "completed"
      }
    ]
  }
}
