{
  "apiVersion": "safe-runtime.dev/tck-fixture/v1alpha1",
  "id": "TCK_FULL_TOOL_003",
  "profile": "FULL",
  "description": "Fake tool runtime reports script exhaustion as infrastructure error and does not invent execution evidence.",
  "determinism": {
    "seed": 11,
    "clock": {
      "startUnixMs": 1787040000000,
      "tickMs": 10
    }
  },
  "stimulus": {
    "operation": "tool.sequence",
    "script": [
      { "kind": "RESULT", "result": { "content": "first" } }
    ],
    "requests": [
      { "callRef": "call-1", "toolName": "demo.echo", "arguments": null },
      { "callRef": "call-2", "toolName": "demo.echo", "arguments": null }
    ]
  },
  "expect": {
    "outcomesBeforeError": [
      { "kind": "RESULT", "result": { "content": "first" } }
    ],
    "errorCode": "FAKE_TOOL_SCRIPT_EXHAUSTED",
    "traceBeforeError": [
      {
        "sequence": 1,
        "callOrdinal": 1,
        "phase": "REQUESTED",
        "request": { "callRef": "call-1", "toolName": "demo.echo", "arguments": null }
      },
      { "sequence": 2, "callOrdinal": 1, "phase": "BODY_ENTERED", "callRef": "call-1" },
      {
        "sequence": 3,
        "callOrdinal": 1,
        "phase": "OUTCOME",
        "callRef": "call-1",
        "outcome": { "kind": "RESULT", "result": { "content": "first" } }
      }
    ]
  }
}
